{
  "$schema": "https://json-schema.org/draft/2020-12/schema",
  "$id": "https://raw.githubusercontent.com/FivePRS/registry/master/schema/listing.schema.json",
  "title": "FivePRS asset listing",
  "description": "One community asset listed on fiveprs.org/assets.",
  "type": "object",
  "additionalProperties": false,
  "required": ["id", "name", "category", "summary", "author", "repository", "source"],
  "properties": {
    "$schema": {
      "type": "string"
    },
    "id": {
      "description": "Unique id used in the URL, fiveprs.org/assets/<id>. Must match the file name.",
      "type": "string",
      "pattern": "^[a-z0-9](?:[a-z0-9-]{1,48}[a-z0-9])$"
    },
    "name": {
      "description": "Display name.",
      "type": "string",
      "minLength": 3,
      "maxLength": 60
    },
    "category": {
      "description": "Where the asset is listed.",
      "enum": ["callouts", "plugins", "apps", "scripts", "vehicles", "maps", "clothing"]
    },
    "summary": {
      "description": "One or two sentences shown on the listing card.",
      "type": "string",
      "minLength": 20,
      "maxLength": 160
    },
    "author": {
      "description": "Your name or team name as you want it shown.",
      "type": "string",
      "minLength": 2,
      "maxLength": 40
    },
    "repository": {
      "description": "The public GitHub repository the asset is released from, as owner/name.",
      "type": "string",
      "pattern": "^[A-Za-z0-9-]{1,39}/[A-Za-z0-9._-]{1,100}$"
    },
    "source": {
      "description": "open if the repository contains the source code under a license, closed if it only hosts releases.",
      "enum": ["open", "closed"]
    },
    "asset": {
      "description": "File name of the download attached to each release. A version suffix is allowed: my-pack.zip also matches my-pack-1.2.0.zip. Leave out to link to the releases page.",
      "type": "string",
      "pattern": "^[A-Za-z0-9._-]+\\.(zip|7z|rar)$"
    },
    "readme": {
      "description": "Path to the Markdown file shown on the listing page, for repositories that hold more than one asset. Leave out to show the repository's README.",
      "type": "string",
      "maxLength": 200,
      "pattern": "^(?![/.])(?!.*\\.\\.)[A-Za-z0-9 ._()\\[\\]/-]+\\.md$"
    },
    "homepage": {
      "description": "Documentation or a project page.",
      "type": "string",
      "format": "uri",
      "pattern": "^https://"
    },
    "image": {
      "description": "A 16:9 preview image (PNG, JPEG, WebP or GIF) at a stable https:// URL, up to 2 MB.",
      "type": "string",
      "format": "uri",
      "pattern": "^https://"
    },
    "tags": {
      "description": "Up to 6 lowercase tags to help people find the asset.",
      "type": "array",
      "maxItems": 6,
      "uniqueItems": true,
      "items": {
        "type": "string",
        "pattern": "^[a-z0-9][a-z0-9-]{0,23}$"
      }
    },
    "minVersion": {
      "description": "The oldest FivePRS version the asset works with.",
      "type": "string",
      "pattern": "^\\d+\\.\\d+\\.\\d+(-[0-9a-z.]+)?$"
    }
  }
}
